{
  "id": "las-vegas-nv",
  "name": "Las Vegas",
  "state": "NV",
  "tripId": "west",
  "stay": {
    "arrive": "2025-10-09",
    "depart": "2025-10-14",
    "nights": 5
  },
  "coords": {
    "lat": 36.1699,
    "lng": -115.1398
  },
  "elevationFt": 2001,
  "population": {
    "cityProper": 656274,
    "metro": 2336573,
    "note": "City-proper and metro figures are approximate estimates pending Census reconciliation. Clark County unincorporated areas (much of the actual built-up Las Vegas Valley, including the Strip itself) fall outside city-proper limits, which understates the city's functional footprint relative to its metro population."
  },
  "vibeWord": "",
  "tagline": "",
  "wouldILiveHere": {
    "verdict": null,
    "note": ""
  },
  "fingerprint": {
    "food": null,
    "musicScene": null,
    "weirdness": null,
    "politicalEnergy": null,
    "cost": null,
    "interestCoverage": null
  },
  "recommendations": [
    {
      "name": "The Writer's Block",
      "categoryNum": 1,
      "source": {
        "type": "retro-guide",
        "citedFrom": [
          {
            "source": "web-search",
            "label": "Las Vegas Weekly",
            "url": null
          },
          {
            "source": "web-search",
            "label": "Smart Vegas Deals",
            "url": null
          }
        ]
      },
      "status": "retroactive-recommendation",
      "interestTags": [
        "i-books"
      ],
      "estCost": "$0–35",
      "bestTimeOfDay": "Evening if there's a reading",
      "durationMin": 60,
      "district": "Downtown Arts District",
      "rating": null,
      "note": "Downtown's flagship indie bookstore, Las Vegas Weekly's 2025 Readers' Choice Best Bookstore — literary fiction, poetry, deep Nevada-authors section, Onyx Coffee Lab built in, 2-4 events weekly.",
      "verifiedOpen": null
    },
    {
      "name": "Amber Unicorn Books",
      "categoryNum": 1,
      "source": {
        "type": "retro-guide",
        "citedFrom": [
          {
            "source": "web-search",
            "label": "Smart Vegas Deals",
            "url": null
          }
        ]
      },
      "status": "retroactive-recommendation",
      "interestTags": [
        "i-books"
      ],
      "estCost": "$1–20",
      "bestTimeOfDay": "Afternoon",
      "durationMin": 60,
      "district": null,
      "rating": null,
      "note": "Warehouse-style used bookstore, 60,000+ books at $1–5, sourced via estate sales and a walk-in buying program — genuine treasure-hunt browsing.",
      "verifiedOpen": null
    },
    {
      "name": "Dead Poet Books",
      "categoryNum": 1,
      "source": {
        "type": "retro-guide",
        "citedFrom": [
          {
            "source": "web-search",
            "label": "Smart Vegas Deals",
            "url": null
          }
        ]
      },
      "status": "retroactive-recommendation",
      "interestTags": [
        "i-books"
      ],
      "estCost": "$5–60+",
      "bestTimeOfDay": "Afternoon",
      "durationMin": 45,
      "district": null,
      "rating": null,
      "note": "Small, tightly curated used shop — literary fiction, poetry, rare and signed first editions.",
      "verifiedOpen": null
    },
    {
      "name": "Get Booked",
      "categoryNum": 1,
      "source": {
        "type": "retro-guide",
        "citedFrom": [
          {
            "source": "web-search",
            "label": "GayCities Las Vegas",
            "url": null
          }
        ]
      },
      "status": "retroactive-recommendation",
      "interestTags": [
        "i-political",
        "i-books"
      ],
      "estCost": "$5–30",
      "bestTimeOfDay": "Afternoon",
      "durationMin": 30,
      "district": "Fruit Loop",
      "rating": null,
      "note": "Vegas's only gay-owned LGBTQ+ retail bookstore since 1993 — part bookshop, part community fixture, queer fiction alongside its adult-shop inventory.",
      "verifiedOpen": null
    },
    {
      "name": "The Book Cellar",
      "categoryNum": 1,
      "source": {
        "type": "retro-guide",
        "citedFrom": [
          {
            "source": "web-search",
            "label": "Smart Vegas Deals",
            "url": null
          }
        ]
      },
      "status": "retroactive-recommendation",
      "interestTags": [
        "i-books"
      ],
      "estCost": "$5–40",
      "bestTimeOfDay": "Weekday afternoon",
      "durationMin": 20,
      "district": null,
      "rating": null,
      "note": "Academic used-book shop near UNLV — textbooks, scholarly presses, discount research texts. Modest fifth pick, included for completeness.",
      "verifiedOpen": null
    },
    {
      "name": "Vinyl Threat @ The Punk Rock Museum",
      "categoryNum": 2,
      "source": {
        "type": "retro-guide",
        "citedFrom": [
          {
            "source": "web-search",
            "label": "The Punk Rock Museum",
            "url": null
          },
          {
            "source": "web-search",
            "label": "Rebel Atlas",
            "url": null
          }
        ]
      },
      "status": "retroactive-recommendation",
      "interestTags": [
        "i-punk",
        "i-diy"
      ],
      "estCost": "$10–50",
      "bestTimeOfDay": "Afternoon",
      "durationMin": 45,
      "district": null,
      "rating": null,
      "note": "The museum's in-house record shop, punk vinyl tied to the archive, plus rare demos pressed exclusively on the shop's own TPRM ODs label.",
      "verifiedOpen": null
    },
    {
      "name": "11th Street Records",
      "categoryNum": 2,
      "source": {
        "type": "retro-guide",
        "citedFrom": [
          {
            "source": "web-search",
            "label": "Rebel Atlas",
            "url": null
          }
        ]
      },
      "status": "retroactive-recommendation",
      "interestTags": [
        "i-punk",
        "i-diy"
      ],
      "estCost": "$8–30",
      "bestTimeOfDay": "Evening",
      "durationMin": 45,
      "district": null,
      "rating": null,
      "note": "A working part of the local music ecosystem downtown, with an in-store studio hosting live sessions, tied into East Fremont's smaller venues.",
      "verifiedOpen": null
    },
    {
      "name": "Cash 4 Chaos",
      "categoryNum": 2,
      "source": {
        "type": "retro-guide",
        "citedFrom": [
          {
            "source": "web-search",
            "label": "Rebel Atlas",
            "url": null
          }
        ]
      },
      "status": "retroactive-recommendation",
      "interestTags": [
        "i-punk"
      ],
      "estCost": "$5–35",
      "bestTimeOfDay": "Afternoon",
      "durationMin": 45,
      "district": null,
      "rating": null,
      "note": "Punk/metal specialist since 1998, blending records with band shirts, patches, and scene ephemera — built by lifers, not trend forecasters.",
      "verifiedOpen": null
    },
    {
      "name": "Primitive Recordings",
      "categoryNum": 2,
      "source": {
        "type": "retro-guide",
        "citedFrom": [
          {
            "source": "web-search",
            "label": "Rebel Atlas",
            "url": null
          }
        ]
      },
      "status": "retroactive-recommendation",
      "interestTags": [
        "i-horror",
        "i-punk"
      ],
      "estCost": "$5–40",
      "bestTimeOfDay": "Afternoon",
      "durationMin": 45,
      "district": null,
      "rating": null,
      "note": "Metal/horror/sci-fi specialist carrying extreme metal, underground shirts, and tapes not always available online.",
      "verifiedOpen": null
    },
    {
      "name": "Wax Trax Records",
      "categoryNum": 2,
      "source": {
        "type": "retro-guide",
        "citedFrom": [
          {
            "source": "web-search",
            "label": "Rebel Atlas",
            "url": null
          }
        ]
      },
      "status": "retroactive-recommendation",
      "interestTags": [
        "i-diy"
      ],
      "estCost": "$10–40",
      "bestTimeOfDay": "Afternoon",
      "durationMin": 60,
      "district": null,
      "rating": null,
      "note": "A three-floor operation for serious crate-diggers — the broad, well-known pick alongside the punk/metal specialists above.",
      "verifiedOpen": null
    },
    {
      "name": "PublicUs",
      "categoryNum": 3,
      "source": {
        "type": "retro-guide",
        "citedFrom": [
          {
            "source": "web-search",
            "label": "Vegas 411",
            "url": null
          }
        ]
      },
      "status": "retroactive-recommendation",
      "interestTags": [
        "i-bees",
        "i-food"
      ],
      "estCost": "$5–14",
      "bestTimeOfDay": "Morning",
      "durationMin": 60,
      "district": "Fremont East",
      "rating": null,
      "note": "Downtown's hybrid café-marketplace — pour-over and Japanese iced coffee, plus an honey toast and elevated brunch program.",
      "verifiedOpen": null
    },
    {
      "name": "Vesta Coffee Roasters",
      "categoryNum": 3,
      "source": {
        "type": "retro-guide",
        "citedFrom": [
          {
            "source": "web-search",
            "label": "Vegas 411",
            "url": null
          }
        ]
      },
      "status": "retroactive-recommendation",
      "interestTags": [
        "i-food"
      ],
      "estCost": "$4–8",
      "bestTimeOfDay": "Morning",
      "durationMin": 30,
      "district": "Arts District",
      "rating": null,
      "note": "A no-pretense specialty roaster — smooth espresso, strong cold brew and cortado program.",
      "verifiedOpen": null
    },
    {
      "name": "Gäbi Coffee & Bakery",
      "categoryNum": 3,
      "source": {
        "type": "retro-guide",
        "citedFrom": [
          {
            "source": "web-search",
            "label": "Vegas 411",
            "url": null
          }
        ]
      },
      "status": "retroactive-recommendation",